{
  "schema_version": "1.0",
  "artifact_type": "coupang_product_evidence_capture",
  "capture_id": "0cd2f416-ad73-4efb-ad6e-83025e96cc86",
  "captured_at": "2026-07-27T09:00:00Z",
  "status": "PARTIAL",
  "collector": {
    "method": "browser-harness",
    "version": "1.1.0"
  },
  "product": {
    "requested_url": "https://www.coupang.com/vp/products/9623659088?itemId=28739122241&vendorItemId=95678577209",
    "normalized_url": "https://www.coupang.com/vp/products/9623659088?itemId=28739122241&vendorItemId=95678577209",
    "product_id": "9623659088",
    "item_id": "28739122241",
    "vendor_item_id": "95678577209",
    "final_url": "https://www.coupang.com/vp/products/9623659088?itemId=28739122241&vendorItemId=95678577209",
    "title": "살랑 루즈핏 쿨토시 여성 헐렁한 냉감 팔토시 자외선 UV차단 운전 손등커버"
  },
  "thumbnails": {
    "schema_version": "1.0",
    "fragment_type": "thumbnails",
    "captured_at": "2026-07-27T08:59:41.561Z",
    "collector_version": "1.1.0",
    "product": {
      "final_url": "https://www.coupang.com/vp/products/9623659088?itemId=28739122241&vendorItemId=95678577209",
      "product_id": "9623659088",
      "item_id": "28739122241",
      "vendor_item_id": "95678577209",
      "title": "살랑 루즈핏 쿨토시 여성 헐렁한 냉감 팔토시 자외선 UV차단 운전 손등커버"
    },
    "status": "READY",
    "assets": [
      {
        "order": 1,
        "source_asset_url": "https://thumbnail.coupangcdn.com/thumbnails/remote/492x492ex/image/vendor_inventory/8c15/f8d08fab2d7301cd73f7233094153ed525563b07de0f334e09126260325b.png",
        "natural_width": 492,
        "natural_height": 492,
        "selected_option_text": null,
        "selected_by": "gallery_click",
        "status": "READY",
        "file": {
          "path": "thumbnail/assets/thumbnail-001.png",
          "bytes": 368691,
          "sha256": "cf176acc847e9867c918134ee7a5035cf575b2b33086ba8b84e5e30074f1f3f5",
          "content_type": "image/png",
          "source_asset_url": "https://thumbnail.coupangcdn.com/thumbnails/remote/492x492ex/image/vendor_inventory/8c15/f8d08fab2d7301cd73f7233094153ed525563b07de0f334e09126260325b.png",
          "section": "thumbnails",
          "order": 1
        }
      },
      {
        "order": 2,
        "source_asset_url": "https://thumbnail.coupangcdn.com/thumbnails/remote/492x492ex/image/vendor_inventory/be93/28d0ef9997ec7bf48c6a1f6e034a201aee82b55f7559fee5240ffaa40ae7.png",
        "natural_width": 492,
        "natural_height": 492,
        "selected_option_text": null,
        "selected_by": "gallery_click",
        "status": "READY",
        "file": {
          "path": "thumbnail/assets/thumbnail-002.png",
          "bytes": 346578,
          "sha256": "4cbe42be514f7ebd5f68f9ec877f45aede7bbb1d9bf3a4f5a6d2448b601857b5",
          "content_type": "image/png",
          "source_asset_url": "https://thumbnail.coupangcdn.com/thumbnails/remote/492x492ex/image/vendor_inventory/be93/28d0ef9997ec7bf48c6a1f6e034a201aee82b55f7559fee5240ffaa40ae7.png",
          "section": "thumbnails",
          "order": 2
        }
      },
      {
        "order": 3,
        "source_asset_url": "https://thumbnail.coupangcdn.com/thumbnails/remote/492x492ex/image/vendor_inventory/bce3/008b66a4de95c88c8909fac457f6ec078aaaa0f55bb9e0219ee89fdf33eb.png",
        "natural_width": 492,
        "natural_height": 492,
        "selected_option_text": null,
        "selected_by": "gallery_click",
        "status": "READY",
        "file": {
          "path": "thumbnail/assets/thumbnail-003.png",
          "bytes": 337969,
          "sha256": "523d71e4655c9446a6efd1aae0237be0e331a71e734fc593187e72230f46339d",
          "content_type": "image/png",
          "source_asset_url": "https://thumbnail.coupangcdn.com/thumbnails/remote/492x492ex/image/vendor_inventory/bce3/008b66a4de95c88c8909fac457f6ec078aaaa0f55bb9e0219ee89fdf33eb.png",
          "section": "thumbnails",
          "order": 3
        }
      },
      {
        "order": 4,
        "source_asset_url": "https://thumbnail.coupangcdn.com/thumbnails/remote/492x492ex/image/vendor_inventory/beab/dbe8e4cfe8f270e7ff41339feef6dae63ce332c437eb7341b7df3bc952bc.png",
        "natural_width": 492,
        "natural_height": 492,
        "selected_option_text": null,
        "selected_by": "gallery_click",
        "status": "READY",
        "file": {
          "path": "thumbnail/assets/thumbnail-004.png",
          "bytes": 360906,
          "sha256": "ec039093e4330846225bfa11c6bb77e58266ca29c72f995c08fea5f5854f9b86",
          "content_type": "image/png",
          "source_asset_url": "https://thumbnail.coupangcdn.com/thumbnails/remote/492x492ex/image/vendor_inventory/beab/dbe8e4cfe8f270e7ff41339feef6dae63ce332c437eb7341b7df3bc952bc.png",
          "section": "thumbnails",
          "order": 4
        }
      },
      {
        "order": 5,
        "source_asset_url": "https://thumbnail.coupangcdn.com/thumbnails/remote/492x492ex/image/vendor_inventory/1a26/a57086e07ea5552c5c44511d281bc3136118e5d50877b1c06fc00b4a4814.png",
        "natural_width": 492,
        "natural_height": 492,
        "selected_option_text": null,
        "selected_by": "gallery_click",
        "status": "READY",
        "file": {
          "path": "thumbnail/assets/thumbnail-005.png",
          "bytes": 307972,
          "sha256": "4f8abf0bdaa612a3081e05d0757aa8b3d32d1708105efc94104fd1069e048df4",
          "content_type": "image/png",
          "source_asset_url": "https://thumbnail.coupangcdn.com/thumbnails/remote/492x492ex/image/vendor_inventory/1a26/a57086e07ea5552c5c44511d281bc3136118e5d50877b1c06fc00b4a4814.png",
          "section": "thumbnails",
          "order": 5
        }
      }
    ],
    "diagnostics": {
      "gallery_items_found": 5,
      "gallery_items_completed": 5,
      "duplicate_count": 0,
      "item_failures": [],
      "stop_reason": "NO_MORE_ITEMS",
      "download_failure_count": 0
    },
    "rights": {
      "scope": "research_reference_only",
      "production_use_allowed": false,
      "reviewer_identity_stored": false
    },
    "representative_file": {
      "path": "thumbnail/thumbnail.png",
      "bytes": 368300,
      "sha256": "bc328758a4299e8f402941df59566ca3751fc2a8cbc8fa92afa08a0e4a5cb3a7",
      "content_type": "image/png",
      "section": "thumbnails",
      "kind": "representative_thumbnail",
      "width_px": 492,
      "height_px": 492
    }
  },
  "detail": {
    "schema_version": "1.0",
    "fragment_type": "detail",
    "captured_at": "2026-07-27T08:59:53.347Z",
    "collector_version": "1.1.0",
    "product": {
      "final_url": "https://www.coupang.com/vp/products/9623659088?itemId=28739122241&vendorItemId=95678577209",
      "product_id": "9623659088",
      "item_id": "28739122241",
      "vendor_item_id": "95678577209",
      "title": "살랑 루즈핏 쿨토시 여성 헐렁한 냉감 팔토시 자외선 UV차단 운전 손등커버"
    },
    "status": "READY",
    "assets": [
      {
        "order": 1,
        "source_asset_url": "https://thumbnail.coupangcdn.com/thumbnails/remote/q89/image/vendor_inventory/cb4c/7f5580a83c2ff9569b4ec5a4df66b0268a7623698bcef9b48ee391010bf9.png",
        "natural_width": 780,
        "natural_height": 5000,
        "document_y": 2168,
        "confidence": "confirmed",
        "selection_reasons": [
          "VENDOR_INVENTORY",
          "DETAIL_REGION",
          "LARGE_IMAGE"
        ],
        "status": "READY",
        "file": {
          "path": "detail/assets/detail-001.png",
          "bytes": 3189262,
          "sha256": "dcca1cab81817af7191b87efc189cefe0d3c4d5f49759a006f9fd9bbdef6e33e",
          "content_type": "image/png",
          "source_asset_url": "https://thumbnail.coupangcdn.com/thumbnails/remote/q89/image/vendor_inventory/cb4c/7f5580a83c2ff9569b4ec5a4df66b0268a7623698bcef9b48ee391010bf9.png",
          "section": "detail",
          "order": 1
        }
      },
      {
        "order": 2,
        "source_asset_url": "https://thumbnail.coupangcdn.com/thumbnails/remote/q89/image/vendor_inventory/a583/f76abdd029a1b25b83f63839db454f78549b16fa16e09970fbcba1840cef.png",
        "natural_width": 780,
        "natural_height": 5000,
        "document_y": 7168,
        "confidence": "confirmed",
        "selection_reasons": [
          "VENDOR_INVENTORY",
          "DETAIL_REGION",
          "LARGE_IMAGE"
        ],
        "status": "READY",
        "file": {
          "path": "detail/assets/detail-002.png",
          "bytes": 2885278,
          "sha256": "0cb787b5fc7872a5d946d084ca4d74a0875f802f2ae1882d94b8a1e640bbd017",
          "content_type": "image/png",
          "source_asset_url": "https://thumbnail.coupangcdn.com/thumbnails/remote/q89/image/vendor_inventory/a583/f76abdd029a1b25b83f63839db454f78549b16fa16e09970fbcba1840cef.png",
          "section": "detail",
          "order": 2
        }
      },
      {
        "order": 3,
        "source_asset_url": "https://thumbnail.coupangcdn.com/thumbnails/remote/q89/image/vendor_inventory/920f/908e23f7c30779b25f693e13be7f2e9d7f2913fd431974938d1d34feeef5.png",
        "natural_width": 780,
        "natural_height": 5000,
        "document_y": 12168,
        "confidence": "confirmed",
        "selection_reasons": [
          "VENDOR_INVENTORY",
          "DETAIL_REGION",
          "LARGE_IMAGE"
        ],
        "status": "READY",
        "file": {
          "path": "detail/assets/detail-003.png",
          "bytes": 3411011,
          "sha256": "c5ec74191c0c0531313f8c5a45d86022c017268e73885dd77812f0a06c291b9e",
          "content_type": "image/png",
          "source_asset_url": "https://thumbnail.coupangcdn.com/thumbnails/remote/q89/image/vendor_inventory/920f/908e23f7c30779b25f693e13be7f2e9d7f2913fd431974938d1d34feeef5.png",
          "section": "detail",
          "order": 3
        }
      },
      {
        "order": 4,
        "source_asset_url": "https://thumbnail.coupangcdn.com/thumbnails/remote/q89/image/vendor_inventory/4580/df6713f802a26834e9650db4a8808070940f4196568feb38c02fe4d55adc.png",
        "natural_width": 780,
        "natural_height": 5000,